{
  "$schema": "https://json-schema.org/draft/2020-12/schema",
  "$id": "https://rivet.local/contracts/showcase-product.schema.json",
  "title": "ShowcaseProduct",
  "description": "A real, buildable product whose maker publishes a parts list, collected ahead of time (docs/e-commerce-layer/plan-showcase.md 3.1). Every part exists because the source page names it and a fetched vendor page quotes its SKU. Never synthetic.",
  "type": "object",
  "additionalProperties": false,
  "required": [
    "schema_version",
    "product_id",
    "name",
    "category",
    "summary",
    "image",
    "source",
    "parts",
    "unsourced_parts",
    "totals",
    "status",
    "generated_at",
    "synthetic"
  ],
  "properties": {
    "schema_version": { "const": "1.0" },
    "product_id": { "type": "string", "pattern": "^[a-z0-9][a-z0-9-]{2,79}$" },
    "name": { "type": "string", "minLength": 1, "maxLength": 160 },
    "category": { "$ref": "#/$defs/Category" },
    "summary": { "type": "string", "maxLength": 600 },
    "image": { "$ref": "#/$defs/Image" },
    "source": { "$ref": "#/$defs/Source" },
    "parts": { "type": "array", "items": { "$ref": "#/$defs/Part" } },
    "unsourced_parts": { "type": "array", "items": { "$ref": "#/$defs/UnsourcedPart" } },
    "totals": { "$ref": "#/$defs/Totals" },
    "status": {
      "description": "complete: every named part is sourced. partial: some named parts have no vendor link (listed in unsourced_parts).",
      "enum": ["complete", "partial"]
    },
    "generated_at": { "$ref": "#/$defs/Timestamp" },
    "synthetic": { "const": false }
  },
  "$defs": {
    "Timestamp": { "type": "string", "pattern": "^\\d{4}-\\d{2}-\\d{2}T\\d{2}:\\d{2}:\\d{2}(\\.\\d+)?Z$" },
    "HttpsUrl": { "type": "string", "pattern": "^https://[^\\s/?#]+[^\\s]*$", "maxLength": 2048 },
    "Money": {
      "type": ["string", "null"],
      "pattern": "^([1-9][0-9]*(\\.[0-9]{1,4})?|0\\.[0-9]{0,3}[1-9][0-9]{0,3})$",
      "maxLength": 24
    },
    "Category": { "enum": ["rover", "robot", "drone", "wearable", "iot", "audio", "display", "tool", "other"] },
    "Image": {
      "description": "Remote image from the source page; the binary is not committed. credit and license are shown next to it.",
      "type": "object",
      "additionalProperties": false,
      "required": ["url", "credit", "license"],
      "properties": {
        "url": { "$ref": "#/$defs/HttpsUrl" },
        "credit": { "type": "string", "minLength": 1, "maxLength": 200 },
        "license": { "type": "string", "minLength": 1, "maxLength": 80 }
      }
    },
    "Source": {
      "type": "object",
      "additionalProperties": false,
      "required": ["url", "host_tier", "title", "fetched_at", "content_sha256"],
      "properties": {
        "url": { "$ref": "#/$defs/HttpsUrl" },
        "host_tier": { "enum": ["manufacturer", "distributor", "teardown", "community"] },
        "title": { "type": "string", "minLength": 1, "maxLength": 200 },
        "fetched_at": { "$ref": "#/$defs/Timestamp" },
        "content_sha256": { "type": "string", "pattern": "^[0-9a-f]{64}$" }
      }
    },
    "Vendor": {
      "type": "object",
      "additionalProperties": false,
      "required": ["id", "name", "tier", "domain"],
      "properties": {
        "id": { "type": "string", "pattern": "^[a-z0-9][a-z0-9_.-]{0,62}$" },
        "name": { "type": "string", "minLength": 1, "maxLength": 120 },
        "tier": { "enum": ["manufacturer", "authorized_distributor", "marketplace", "reseller", "unknown"] },
        "domain": { "type": "string", "pattern": "^[a-z0-9.-]+\\.[a-z]{2,}$" }
      }
    },
    "Part": {
      "type": "object",
      "additionalProperties": false,
      "required": [
        "part_id", "name", "quantity", "sku", "mpn", "manufacturer", "vendor", "url",
        "price_amount", "currency", "availability", "fetched_at", "source_sha256",
        "evidence_level", "evidence_quote", "bom_quote"
      ],
      "properties": {
        "part_id": { "type": "string", "pattern": "^[a-z0-9][a-z0-9-]{0,79}$" },
        "name": { "type": "string", "minLength": 1, "maxLength": 200 },
        "quantity": { "type": "integer", "minimum": 1 },
        "sku": { "type": "string", "minLength": 1, "maxLength": 64 },
        "mpn": { "type": ["string", "null"], "minLength": 1, "maxLength": 64 },
        "manufacturer": { "type": ["string", "null"], "minLength": 1, "maxLength": 120 },
        "vendor": { "$ref": "#/$defs/Vendor" },
        "url": { "$ref": "#/$defs/HttpsUrl" },
        "price_amount": { "$ref": "#/$defs/Money" },
        "currency": { "type": ["string", "null"], "pattern": "^[A-Z]{3}$" },
        "availability": { "enum": ["in_stock", "out_of_stock", "backorder", "discontinued", "unknown"] },
        "fetched_at": { "$ref": "#/$defs/Timestamp" },
        "source_sha256": { "type": "string", "pattern": "^[0-9a-f]{64}$" },
        "evidence_level": { "enum": ["verified", "inferred", "stale"] },
        "evidence_quote": { "description": "Quote from the part's vendor page containing the SKU.", "type": "string", "minLength": 1, "maxLength": 400 },
        "bom_quote": { "description": "Quote from the product's source page naming the part.", "type": "string", "minLength": 1, "maxLength": 400 }
      },
      "allOf": [
        { "if": { "properties": { "price_amount": { "type": "string" } } }, "then": { "properties": { "currency": { "type": "string" } } } }
      ]
    },
    "UnsourcedPart": {
      "type": "object",
      "additionalProperties": false,
      "required": ["name", "quantity", "note"],
      "properties": {
        "name": { "type": "string", "minLength": 1, "maxLength": 200 },
        "quantity": { "type": ["integer", "null"], "minimum": 1 },
        "note": { "type": "string", "minLength": 1, "maxLength": 300 }
      }
    },
    "Totals": {
      "type": "object",
      "additionalProperties": false,
      "required": ["parts_total", "parts_verified", "price_total_amount", "currency"],
      "properties": {
        "parts_total": { "type": "integer", "minimum": 0 },
        "parts_verified": { "type": "integer", "minimum": 0 },
        "price_total_amount": { "description": "Sum of quantity x price over sourced parts, only when every sourced part has a price in one currency; else null.", "$ref": "#/$defs/Money" },
        "currency": { "type": ["string", "null"], "pattern": "^[A-Z]{3}$" }
      }
    },
    "IndexEntry": {
      "type": "object",
      "additionalProperties": false,
      "required": ["product_id", "name", "category", "image", "parts_total", "parts_verified", "status"],
      "properties": {
        "product_id": { "type": "string", "pattern": "^[a-z0-9][a-z0-9-]{2,79}$" },
        "name": { "type": "string", "minLength": 1, "maxLength": 160 },
        "category": { "$ref": "#/$defs/Category" },
        "image": { "$ref": "#/$defs/Image" },
        "parts_total": { "type": "integer", "minimum": 0 },
        "parts_verified": { "type": "integer", "minimum": 0 },
        "status": { "enum": ["complete", "partial"] }
      }
    },
    "ShowcaseIndex": {
      "type": "object",
      "additionalProperties": false,
      "required": ["schema_version", "generated_at", "products"],
      "properties": {
        "schema_version": { "const": "1.0" },
        "generated_at": { "$ref": "#/$defs/Timestamp" },
        "products": { "type": "array", "items": { "$ref": "#/$defs/IndexEntry" } }
      }
    }
  }
}
